sentence,remark
在二战期间，英美军方基于返航战机弹痕分布数据提出“弹痕多=需加强防护”的结论，而统计学家亚伯拉罕·瓦尔德（Abraham Wald）通过逆向思维揭示了这一决策的致命漏洞：‌返航飞机的弹痕分布仅代表“可承受损伤”，而引擎、驾驶舱等弹痕少的部位一旦中弹，战机往往无法幸存，导致这些关键部位的受损数据被系统性遗漏‌。这一洞见不仅修正了军方决策，更成为统计学中“幸存者偏差”的经典案例‌,
长期孤独的人与社交活跃的人相比，其白细胞中的基因表达存在显著差异。孤独者的基因表达倾向于促进炎症反应，而社交活跃者的基因表达则倾向于抗病毒反应。这种差异可能与早期人类的社会环境和生存挑战有关。 https://www.scientificamerican.com/article/how-happiness-boosts-the-immune-system/ ,
要有一个偏创造输出型的爱好。旅行、阅读、看演唱会、看电影，这些爱好当然很好，但它们都偏享乐型。享乐型的爱好可以娱乐自己，让自己开心，但遗憾的是，它们很难形成作品，并对别人产生帮助或者影响。做一个产品，开一家公司，运营一个抖音号，写一篇文章，拍一组照片，这都是创造。,
无论什么境遇下，都让自己处于创造的状态里，创造一篇对别人有用的文章，创造一个对别人有用的产品，创造一个对别人有用的观点。主动地去创造，创造才可能获得机会。,
观看广告时，分析广告投放的品类、品牌选择、广告设计等问题，有助于形成对商业策略的理解。,
YouTuber、创作者们将工作流封装成模板，本质上是在用非编码方式开发软件。有位生活方式博主把内容日历模板卖出 900 美元/份，充分证明工具赋能的潜力。,
问题就是机会。商机就是，你能用更好的办法为别人解决问题，别人愿意为此付费。,
问题就是机会。别人有没有类似问题，能否提供解决方案，是否为商机。,
一个事情发生，如果三年后回头看它不重要，那它在这个时间也不重要。,
16 岁移民加拿大时，我发现国内学的都是应试英语，严重缺乏文化语境。要理解西方幽默，最好的方式就是看《海绵宝宝》和《辛普森一家》。通过动画片掌握“笑点”是教科书永远教不会的技能。 https://m.okjike.com/originalPosts/67d0e9d773ce884ac09be839 ,
应该把革命性愿景藏在人们熟悉的外壳里。就像给小孩喂蔬菜——要把西兰花裹上糖衣，他们才会接受。现在的 Notion 表面是生产力套件，内核却是无代码开发平台。说实话，这个认知的迭代我花了两年多时间。https://m.okjike.com/originalPosts/67d0e9d773ce884ac09be839  ,
商业世界存在两种模式：整合与分拆。计算机发展初期，所有功能都是独立硬件（分）；微软通过 Office 套件实现整合（合）；SaaS 时代又拆分成数百个垂直工具（分）；现在 AI 时代，我们看到整合的回归——平均企业使用近百个 SaaS 工具，这显然不可持续。,
